{"approval_policy_ref":"example://approval/policy-1","authority":{"answer_engines":[{"id":"engine_a"},{"id":"engine_b"}],"citation_rate_floor":"0.25","earned_citations_floor":3,"measurement_window_days":28,"owned_audience":{"double_opt_in":true,"lawful_basis_policy":"example://policy/lawful-basis","suppression_list_ref":"example://suppression/list-1"},"paid_fence":{"allow_brand_terms":true,"allow_category_terms":true,"allow_third_party_operator_terms":false,"brand_term_register_digest":"aaaaaaaaaaaaaaaaaaaaaaaaaaaaaaaaaaaaaaaaaaaaaaaaaaaaaaaaaaaaaaaa","brand_term_register_ref":"example://terms/brand","brand_term_register_version":"brand-1","category_term_register_digest":"bbbbbbbbbbbbbbbbbbbbbbbbbbbbbbbbbbbbbbbbbbbbbbbbbbbbbbbbbbbbbbbb","category_term_register_ref":"example://terms/category","category_term_register_version":"category-1","operator_term_register_digest":"cccccccccccccccccccccccccccccccccccccccccccccccccccccccccccccccc","operator_term_register_ref":"example://terms/operator","operator_term_register_version":"operator-1"},"probe_budget":{"permitted_model_refs":["example-model-a","example-model-b"],"probes_per_engine_per_query_class_per_window":4},"source_diversity_min":2,"target_query_classes":[{"id":"how_to_plan","question":"How do I plan care for a parent?"},{"id":"what_to_bring","question":"What should I bring to an appointment?"}],"wedge":true},"budget_caps":{"model_calls":{"amount":"12.5","currency":"USD","unit":"usd","window":"month"},"probes":{"amount":"40","unit":"probe","window":"week"}},"commercial":{"deliverability":{"bounce_rate_stop":"0.05","complaint_rate_stop":"0.001","minimum_sent":200,"window_days":7},"quote":{"second_signature_above_minor":"250000"},"renewal_attention":{"review_lead_days":30},"unit_economics":{"contribution_margin_floor_minor":"-500","contribution_window_days":90}},"compatibility":{"max_reader":"2.9.0","min_reader":"2.0.0","required_capabilities":["aeos.product-manifest.v2","canonical_manifest_bytes_v2","correction_sweep_queue_admission_v2","correction_sweep_source_binding_v2","correction_sweep_worker_revalidation_v2","effective_interval_v2","purpose_principal_class_matrix_v2","service_principal_grant_set_digest_v2","support_manifest_scope_proposal_v2"]},"content_policy":{"review_age_days":180},"correction_policy":{"acknowledge_within_days":2,"an_overdue_correction_stops_publication":true,"clock":"business_days","resolve_within_days":10},"correction_sweep":{"access_policy_ref":"example://access/sweep-7","calendar":{"artifact_id":"business-calendar","digest":"ffffffffffffffffffffffffffffffffffffffffffffffffffffffffffffffff","dst_fold_rule":"earlier","dst_gap_rule":"next_valid","holidays":["2026-11-26","2026-12-25"],"iana_time_zone":"America/New_York","version":"2026.10","working_days":["friday","monday","thursday","tuesday","wednesday"]},"correction_owner_policy_revision":"example://correction-owner/revision-7","effective_interval":{"decision_ref":"example://decision/source-sweep-interval","ends_before":null,"starts_at":"2026-10-01T00:00:00Z"},"fact_authority_rule":"example://source-policy/fact-authority-7","incident_policy_ref":"example://incident/sweep-7","legal_hold_policy_ref":"example://legal-hold/sweep-7","lookback_algorithm_version":"calendar-months-v1","lookback_months":12,"policy_id":"source-sweep-policy","privacy_policy_refs":["example://privacy/sweep-7"],"retention_policy_ref":"example://retention/sweep-7","source_policy_revisions":["example://source-policy/revision-7"],"version":"7"},"credential_scopes":{"example_mail":["draft","send"],"support:correction_sweep":["run_correction_sweep"]},"effective_interval":{"decision_ref":"example://decision/interval-1","ends_before":null,"starts_at":"2026-10-01T00:00:00Z"},"family_overrides":{},"fcra_posture":"outside_fcra","gating":{"graduation_count":25,"judgment_confidence_gate":"0.8","park_ttl_hours":72,"seed_approval_count":3,"stale_claim_days":30},"liability_class":"B","manifest_version":"example-2026.09.27","modules_enabled":["care","practice"],"portfolio_phase_revision_id":"0190f2a4-1b2c-7d3e-8f40-000000000001","product_instance_id":"0190f2a4-1b2c-7d3e-8f40-5a6b7c8d9e0f","release_policy":{"coverage_thresholds":{"min_overall":"1.0"}},"schema_version":"aeos.product-manifest.v2","service_principal_grants":[{"principal_class":"correction_sweep_service","principal_id":"sweep-service-fixture","purpose":"correction_sweep"},{"principal_class":"marketing_effects_worker","principal_id":"example-worker-1","purpose":"paid_effect"},{"principal_class":"product_policy_read_client","principal_id":"example-reader-1","purpose":"readback"}],"source_bindings":{"correction_sweep":{"digest":"eeeeeeeeeeeeeeeeeeeeeeeeeeeeeeeeeeeeeeeeeeeeeeeeeeeeeeeeeeeeeeee","version":"source-policy-7"},"mailbox_registry":{"digest":"dddddddddddddddddddddddddddddddddddddddddddddddddddddddddddddddd","version":"example-registry-1"}},"task_generation_policy":{"max_open":5},"tone_profile":{"allowed_claim_templates":["example://claims/template-b","example://claims/template-a"],"forbidden_phrases":["guaranteed cure","Example Phrase"],"voice":"Plain, warm, exact — Example voice."},"wlg_sync_policy":{}}